{
  "botAuth": "",
  "botId": "888488557352747020",
  "dblApiKey": "",
  "patreonAccessToken": "",
  "managerApiAuth": "",
  "managerApiHost": "",
  "managerHost": "",
  "managerApiPort": 3000,
  "managerDb": {
    "dbUser": "",
    "dbPassword": "",
    "dbName": ""
  },
  "shardDb": {
    "dbUser": "",
    "dbPassword": "",
    "dbName": ""
  }
}
